{
  "index": "halberds",
  "type": "weapons",
  "name": "halberds",
  "classes": [],
  "url": "/assets/atlas/proficiencies/json/halberds.json",
  "reference": {
    "index": "halberd",
    "name": "halberd",
    "url": "/assets/atlas/equipment/json/halberd.json"
  },
  "updated_at": "2026-06-01T09:48:51.000Z",
  "image": "/assets/atlas/proficiencies/json/wiki_image/wiki_image/halberds.webp",
  "species": [],
  "proficiency_specific": {
    "reference_category": "equipment"
  }
}