{
  "index": "painters_supplies",
  "type": "artisans_tools",
  "name": "painter's supplies",
  "classes": [],
  "url": "/assets/atlas/proficiencies/json/painters_supplies.json",
  "reference": {
    "index": "painters_supplies",
    "name": "painter's supplies",
    "url": "/assets/atlas/equipment/json/painters_supplies.json"
  },
  "updated_at": "2026-06-01T09:48:51.000Z",
  "image": "/assets/atlas/proficiencies/wiki_image/wiki_image/painters_supplies.webp",
  "species": [],
  "proficiency_specific": {
    "reference_category": "equipment"
  }
}